{
  "packet_id": "gen_vent_pos_25",
  "set": "extraction_eval",
  "generator_version": "packet-gen-2",
  "referral_date": "2001-01-10",
  "referral_type": "skilled",
  "documents": [
    {
      "document_id": "doc_fax_cover",
      "type": "fax_cover",
      "pages": [
        1
      ],
      "expected_status": "processed"
    },
    {
      "document_id": "doc_face_sheet",
      "type": "face_sheet",
      "pages": [
        2
      ],
      "expected_status": "processed"
    },
    {
      "document_id": "doc_history_physical",
      "type": "history_physical",
      "pages": [
        3
      ],
      "expected_status": "processed"
    },
    {
      "document_id": "doc_discharge_summary",
      "type": "discharge_summary",
      "pages": [
        4
      ],
      "expected_status": "processed"
    },
    {
      "document_id": "doc_medication_record",
      "type": "medication_record",
      "pages": [
        5
      ],
      "expected_status": "processed"
    },
    {
      "document_id": "doc_nursing_note",
      "type": "nursing_note",
      "pages": [
        6
      ],
      "expected_status": "processed"
    }
  ],
  "facility_profile_ref": "examples/profiles/zztest-facility.json@1",
  "rule_set_ref": "examples/rules@seed",
  "expected": {
    "outcome": "do_not_admit",
    "clinical_outcome": "do_not_admit",
    "financial_status": "clear",
    "sub_reasons": [],
    "triggered_rules": [
      {
        "rule_id": "seed.hard_stop.ventilator",
        "fact_keys": [
          "ventilator_use"
        ]
      },
      {
        "rule_id": "seed.review.behavioral_escalation",
        "fact_keys": [
          "recent_aggression"
        ]
      }
    ],
    "missing": [],
    "conflicts": []
  },
  "adversarial": {
    "planted_visible": [],
    "invisible_text": [],
    "xss_values": [],
    "instruction_text": [],
    "identity_mismatch_pages": []
  },
  "fields": [
    {
      "key": "ventilator_use",
      "value": {
        "type": "tri_state",
        "value": "yes"
      },
      "document_id": "doc_discharge_summary",
      "page": 4,
      "quote": "tracheostomy with ventilator support around the clock",
      "span": {
        "start": 580,
        "end": 633
      },
      "negative_quotes": [
        {
          "page": 4,
          "quote": "prior admission note: weaned from the ventilator last year",
          "fabricated": false
        },
        {
          "page": 4,
          "quote": "patient has been fully independent of all oxygen",
          "fabricated": true
        }
      ],
      "as_of_date": "2001-01-09",
      "polarity": "positive",
      "is_critical": true,
      "specially_protected": false
    },
    {
      "key": "daily_skilled_need",
      "value": {
        "type": "tri_state",
        "value": "no"
      },
      "document_id": "doc_discharge_summary",
      "page": 4,
      "quote": "does not need skilled nursing or therapy each day",
      "span": {
        "start": 488,
        "end": 537
      },
      "negative_quotes": [],
      "as_of_date": "2001-01-09",
      "polarity": "near_miss_negative",
      "is_critical": false,
      "specially_protected": false
    },
    {
      "key": "recent_aggression",
      "value": {
        "type": "tri_state",
        "value": "yes"
      },
      "document_id": "doc_nursing_note",
      "page": 6,
      "quote": "verbal and physical aggression toward staff this week",
      "span": {
        "start": 352,
        "end": 405
      },
      "negative_quotes": [],
      "as_of_date": "2001-01-09",
      "polarity": "positive",
      "is_critical": false,
      "specially_protected": false
    },
    {
      "key": "payer_medicaid_pending",
      "value": {
        "type": "tri_state",
        "value": "yes"
      },
      "document_id": "doc_face_sheet",
      "page": 2,
      "quote": "Medicaid pending with application filed this week",
      "span": {
        "start": 788,
        "end": 837
      },
      "negative_quotes": [],
      "as_of_date": "2001-01-09",
      "polarity": "positive",
      "is_critical": false,
      "specially_protected": false
    },
    {
      "key": "payer_eligibility_verified",
      "value": {
        "type": "tri_state",
        "value": "yes"
      },
      "document_id": "doc_face_sheet",
      "page": 2,
      "quote": "benefits and eligibility confirmed with the payer today",
      "span": {
        "start": 852,
        "end": 907
      },
      "negative_quotes": [],
      "as_of_date": "2001-01-09",
      "polarity": "positive",
      "is_critical": false,
      "specially_protected": false
    }
  ],
  "reviewed_by": "agent-proxy"
}
